{
  "version": "1.0.2",
  "source": "https://hashcat.net/wiki/doku.php?id=example_hashes",
  "description": "HashSight hash-signature database. Every entry is derived from hashcat's own published example hashes. Community contributions welcome via pull request - see CONTRIBUTING.md.",
  "modes": {
    "0": {
      "name": "MD5",
      "category": "Raw Digest",
      "john_format": "raw-md5"
    },
    "10": {
      "name": "md5($pass.$salt)",
      "category": "Salted Digest",
      "john_format": "dynamic_1",
      "salt_len_hint": 6,
      "salt_hex_hint": true
    },
    "11": {
      "name": "Joomla < 2.5.18",
      "category": "Web Application",
      "john_format": "dynamic_1",
      "salt_len_hint": 32,
      "salt_hex_hint": true
    },
    "12": {
      "name": "PostgreSQL",
      "category": "Database",
      "salt_len_hint": 32,
      "salt_hex_hint": true
    },
    "20": {
      "name": "md5($salt.$pass)",
      "category": "Salted Digest",
      "john_format": "dynamic_4",
      "salt_len_hint": 4,
      "salt_hex_hint": true
    },
    "21": {
      "name": "osCommerce, xt:Commerce",
      "category": "Web Application",
      "john_format": "dynamic_4",
      "salt_len_hint": 2,
      "salt_hex_hint": true
    },
    "22": {
      "name": "Juniper NetScreen/SSG (ScreenOS)",
      "category": "Catalog Fallback",
      "john_format": "md5ns",
      "total_len_hint": 35,
      "field_count_hint": 1
    },
    "23": {
      "name": "Skype",
      "category": "Network Auth",
      "total_len_hint": 37,
      "field_count_hint": 1
    },
    "24": {
      "name": "SolarWinds Serv-U",
      "category": "Enterprise/Cloud",
      "total_len_hint": 32,
      "field_count_hint": 0
    },
    "30": {
      "name": "md5(utf16le($pass).$salt)",
      "category": "Salted Digest",
      "salt_len_hint": 12,
      "salt_hex_hint": true
    },
    "40": {
      "name": "md5($salt.utf16le($pass))",
      "category": "Salted Digest",
      "salt_len_hint": 8,
      "salt_hex_hint": true
    },
    "50": {
      "name": "HMAC-MD5 (key = $pass)",
      "category": "Salted Digest",
      "john_format": "hmac-md5"
    },
    "60": {
      "name": "HMAC-MD5 (key = $salt)",
      "category": "Salted Digest",
      "john_format": "hmac-md5"
    },
    "70": {
      "name": "md5(utf16le($pass))",
      "category": "Raw Digest"
    },
    "100": {
      "name": "SHA1",
      "category": "Raw Digest",
      "john_format": "raw-sha1"
    },
    "101": {
      "name": "nsldap, SHA-1(Base64), Netscape LDAP SHA",
      "category": "Directory/LDAP",
      "john_format": "nsldap"
    },
    "110": {
      "name": "sha1($pass.$salt)",
      "category": "Salted Digest",
      "john_format": "dynamic_24",
      "salt_len_hint": 11,
      "salt_hex_hint": true
    },
    "111": {
      "name": "nsldaps, SSHA-1(Base64), Netscape LDAP SSHA",
      "category": "Directory/LDAP",
      "john_format": "salted-sha1"
    },
    "112": {
      "name": "Oracle S: Type (Oracle 11+)",
      "category": "Database",
      "john_format": "oracle11",
      "total_len_hint": 61,
      "field_count_hint": 1
    },
    "120": {
      "name": "sha1($salt.$pass)",
      "category": "Salted Digest",
      "john_format": "dynamic_25",
      "salt_len_hint": 9,
      "salt_hex_hint": true
    },
    "121": {
      "name": "SMF (Simple Machines Forum) > v1.1",
      "category": "Web Application",
      "salt_len_hint": 8,
      "salt_hex_hint": true
    },
    "122": {
      "name": "macOS v10.4, macOS v10.5, macOS v10.6",
      "category": "Catalog Fallback",
      "john_format": "xsha",
      "total_len_hint": 48,
      "field_count_hint": 0
    },
    "123": {
      "name": "EPi",
      "category": "Web Application",
      "john_format": "epi"
    },
    "124": {
      "name": "Django (SHA-1)",
      "category": "Web Application"
    },
    "125": {
      "name": "ArubaOS",
      "category": "Catalog Fallback",
      "total_len_hint": 50,
      "field_count_hint": 0
    },
    "130": {
      "name": "sha1(utf16le($pass).$salt)",
      "category": "Salted Digest",
      "salt_len_hint": 11,
      "salt_hex_hint": true
    },
    "131": {
      "name": "MSSQL (2000)",
      "category": "Database",
      "john_format": "mssql"
    },
    "132": {
      "name": "MSSQL (2005)",
      "category": "Database",
      "john_format": "mssql05"
    },
    "133": {
      "name": "PeopleSoft",
      "category": "Catalog Fallback",
      "total_len_hint": 28,
      "field_count_hint": 0
    },
    "140": {
      "name": "sha1($salt.utf16le($pass))",
      "category": "Salted Digest",
      "salt_len_hint": 6,
      "salt_hex_hint": true
    },
    "141": {
      "name": "Episerver 6.x < .NET 4",
      "category": "Web Application",
      "john_format": "episerver"
    },
    "150": {
      "name": "HMAC-SHA1 (key = $pass)",
      "category": "Salted Digest",
      "john_format": "hmac-sha1"
    },
    "160": {
      "name": "HMAC-SHA1 (key = $salt)",
      "category": "Salted Digest",
      "john_format": "hmac-sha1"
    },
    "170": {
      "name": "sha1(utf16le($pass))",
      "category": "Raw Digest"
    },
    "190": {
      "name": "sha1(LinkedIn)",
      "category": "Web Application",
      "john_format": "raw-sha1-linkedin"
    },
    "200": {
      "name": "MySQL323",
      "category": "Database",
      "john_format": "mysql"
    },
    "300": {
      "name": "MySQL4.1/MySQL5",
      "category": "Database",
      "john_format": "mysql-sha1"
    },
    "400": {
      "name": "phpass, phpBB3 (MD5)",
      "category": "Web Application"
    },
    "501": {
      "name": "Juniper IVE",
      "category": "Catalog Fallback",
      "total_len_hint": 104,
      "field_count_hint": 0
    },
    "600": {
      "name": "BLAKE2b-512",
      "category": "Raw Digest",
      "john_format": "raw-blake2"
    },
    "610": {
      "name": "BLAKE2b-512($pass.$salt)",
      "category": "Salted Digest",
      "salt_len_hint": 4,
      "salt_hex_hint": true
    },
    "620": {
      "name": "BLAKE2b-512($salt.$pass)",
      "category": "Salted Digest",
      "salt_len_hint": 4,
      "salt_hex_hint": true
    },
    "900": {
      "name": "MD4",
      "category": "Raw Digest",
      "john_format": "raw-md4"
    },
    "1000": {
      "name": "NTLM",
      "category": "Windows/AD",
      "john_format": "nt"
    },
    "1100": {
      "name": "Domain Cached Credentials (DCC), MS Cache",
      "category": "Windows/AD",
      "john_format": "mscash",
      "salt_len_hint": 11,
      "salt_hex_hint": true
    },
    "1300": {
      "name": "SHA2-224",
      "category": "Raw Digest",
      "john_format": "raw-sha224"
    },
    "1310": {
      "name": "sha224($pass.$salt)",
      "category": "Salted Digest",
      "john_format": "dynamic_52",
      "salt_len_hint": 44,
      "salt_hex_hint": true
    },
    "1320": {
      "name": "sha224($salt.$pass)",
      "category": "Salted Digest",
      "john_format": "dynamic_51",
      "salt_len_hint": 8,
      "salt_hex_hint": true
    },
    "1400": {
      "name": "SHA2-256",
      "category": "Raw Digest",
      "john_format": "raw-sha256"
    },
    "1410": {
      "name": "sha256($pass.$salt)",
      "category": "Salted Digest",
      "john_format": "dynamic_62",
      "salt_len_hint": 11,
      "salt_hex_hint": true
    },
    "1411": {
      "name": "SSHA-256(Base64), LDAP {SSHA256}",
      "category": "Directory/LDAP"
    },
    "1420": {
      "name": "sha256($salt.$pass)",
      "category": "Salted Digest",
      "john_format": "dynamic_61",
      "salt_len_hint": 8,
      "salt_hex_hint": true
    },
    "1421": {
      "name": "hMailServer",
      "category": "Catalog Fallback",
      "john_format": "hmailserver",
      "total_len_hint": 70,
      "field_count_hint": 0
    },
    "1430": {
      "name": "sha256(utf16le($pass).$salt)",
      "category": "Salted Digest",
      "salt_len_hint": 5,
      "salt_hex_hint": true
    },
    "1440": {
      "name": "sha256($salt.utf16le($pass))",
      "category": "Salted Digest",
      "salt_len_hint": 5,
      "salt_hex_hint": true
    },
    "1441": {
      "name": "Episerver 6.x >= .NET 4",
      "category": "Web Application",
      "john_format": "episerver"
    },
    "1450": {
      "name": "HMAC-SHA256 (key = $pass)",
      "category": "Salted Digest",
      "john_format": "hmac-sha256"
    },
    "1460": {
      "name": "HMAC-SHA256 (key = $salt)",
      "category": "Salted Digest",
      "john_format": "hmac-sha256"
    },
    "1470": {
      "name": "sha256(utf16le($pass))",
      "category": "Raw Digest"
    },
    "1500": {
      "name": "descrypt, DES (Unix), Traditional DES",
      "category": "OS/Unix Crypt",
      "john_format": "descrypt"
    },
    "1600": {
      "name": "Apache $apr1$ MD5, md5apr1, MD5 (APR)",
      "category": "OS/Unix Crypt",
      "john_format": "md5crypt"
    },
    "1700": {
      "name": "SHA2-512",
      "category": "Raw Digest",
      "john_format": "raw-sha512"
    },
    "1710": {
      "name": "sha512($pass.$salt)",
      "category": "Salted Digest",
      "john_format": "dynamic_82",
      "salt_len_hint": 12,
      "salt_hex_hint": true
    },
    "1711": {
      "name": "SSHA-512(Base64), LDAP {SSHA512}",
      "category": "Directory/LDAP",
      "john_format": "ssha512"
    },
    "1720": {
      "name": "sha512($salt.$pass)",
      "category": "Salted Digest",
      "john_format": "dynamic_81",
      "salt_len_hint": 3,
      "salt_hex_hint": true
    },
    "1722": {
      "name": "macOS v10.7",
      "category": "Catalog Fallback",
      "john_format": "xsha512",
      "total_len_hint": 136,
      "field_count_hint": 0
    },
    "1730": {
      "name": "sha512(utf16le($pass).$salt)",
      "category": "Salted Digest",
      "salt_len_hint": 7,
      "salt_hex_hint": true
    },
    "1731": {
      "name": "MSSQL (2012, 2014)",
      "category": "Database",
      "john_format": "mssql12"
    },
    "1740": {